[
  {
    "observation_id": "obs-2026-01-01-openai-gpt4o",
    "schema_version": "1.0.0",
    "provider": "openai",
    "model_id": "gpt-4o",
    "model_display_name": "GPT-4o",
    "input_rate_usd_per_1m": 2.50,
    "output_rate_usd_per_1m": 10.00,
    "effective_date": "2026-01-01",
    "collected_at": "2026-01-01T00:00:00Z",
    "source_url": "https://openrouter.ai/api/v1/models",
    "source_tier": "T1",
    "currency": "USD",
    "collection_method": "fixture",
    "confidence_level": "high",
    "context_window": 128000,
    "max_output_tokens": 16384
  },
  {
    "observation_id": "obs-2026-01-01-openai-gpt4o-mini",
    "schema_version": "1.0.0",
    "provider": "openai",
    "model_id": "gpt-4o-mini",
    "model_display_name": "GPT-4o mini",
    "input_rate_usd_per_1m": 0.15,
    "output_rate_usd_per_1m": 0.60,
    "effective_date": "2026-01-01",
    "collected_at": "2026-01-01T00:00:00Z",
    "source_url": "https://openrouter.ai/api/v1/models",
    "source_tier": "T1",
    "currency": "USD",
    "collection_method": "fixture",
    "confidence_level": "high",
    "context_window": 128000,
    "max_output_tokens": 16384
  },
  {
    "observation_id": "obs-2026-01-01-anthropic-claude35sonnet",
    "schema_version": "1.0.0",
    "provider": "anthropic",
    "model_id": "claude-3-5-sonnet-20241022",
    "model_display_name": "Claude 3.5 Sonnet",
    "input_rate_usd_per_1m": 3.00,
    "output_rate_usd_per_1m": 15.00,
    "effective_date": "2026-01-01",
    "collected_at": "2026-01-01T00:00:00Z",
    "source_url": "https://openrouter.ai/api/v1/models",
    "source_tier": "T1",
    "currency": "USD",
    "collection_method": "fixture",
    "confidence_level": "high",
    "context_window": 200000,
    "max_output_tokens": 8192
  },
  {
    "observation_id": "obs-2026-01-01-anthropic-claude35haiku",
    "schema_version": "1.0.0",
    "provider": "anthropic",
    "model_id": "claude-3-5-haiku-20241022",
    "model_display_name": "Claude 3.5 Haiku",
    "input_rate_usd_per_1m": 0.80,
    "output_rate_usd_per_1m": 4.00,
    "effective_date": "2026-01-01",
    "collected_at": "2026-01-01T00:00:00Z",
    "source_url": "https://openrouter.ai/api/v1/models",
    "source_tier": "T1",
    "currency": "USD",
    "collection_method": "fixture",
    "confidence_level": "high",
    "context_window": 200000,
    "max_output_tokens": 8192
  },
  {
    "observation_id": "obs-2026-01-01-google-gemini15pro",
    "schema_version": "1.0.0",
    "provider": "google",
    "model_id": "gemini-1.5-pro",
    "model_display_name": "Gemini 1.5 Pro",
    "input_rate_usd_per_1m": 1.25,
    "output_rate_usd_per_1m": 5.00,
    "effective_date": "2026-01-01",
    "collected_at": "2026-01-01T00:00:00Z",
    "source_url": "https://openrouter.ai/api/v1/models",
    "source_tier": "T1",
    "currency": "USD",
    "collection_method": "fixture",
    "confidence_level": "high",
    "context_window": 2000000,
    "max_output_tokens": 8192
  },
  {
    "observation_id": "obs-2026-01-01-google-gemini15flash",
    "schema_version": "1.0.0",
    "provider": "google",
    "model_id": "gemini-1.5-flash",
    "model_display_name": "Gemini 1.5 Flash",
    "input_rate_usd_per_1m": 0.075,
    "output_rate_usd_per_1m": 0.30,
    "effective_date": "2026-01-01",
    "collected_at": "2026-01-01T00:00:00Z",
    "source_url": "https://openrouter.ai/api/v1/models",
    "source_tier": "T1",
    "currency": "USD",
    "collection_method": "fixture",
    "confidence_level": "high",
    "context_window": 1000000,
    "max_output_tokens": 8192
  },
  {
    "observation_id": "obs-2026-01-01-mistral-large",
    "schema_version": "1.0.0",
    "provider": "mistral",
    "model_id": "mistral-large-latest",
    "model_display_name": "Mistral Large",
    "input_rate_usd_per_1m": 2.00,
    "output_rate_usd_per_1m": 6.00,
    "effective_date": "2026-01-01",
    "collected_at": "2026-01-01T00:00:00Z",
    "source_url": "https://openrouter.ai/api/v1/models",
    "source_tier": "T1",
    "currency": "USD",
    "collection_method": "fixture",
    "confidence_level": "high",
    "context_window": 128000
  },
  {
    "observation_id": "obs-2026-01-01-mistral-small",
    "schema_version": "1.0.0",
    "provider": "mistral",
    "model_id": "mistral-small-latest",
    "model_display_name": "Mistral Small",
    "input_rate_usd_per_1m": 0.20,
    "output_rate_usd_per_1m": 0.60,
    "effective_date": "2026-01-01",
    "collected_at": "2026-01-01T00:00:00Z",
    "source_url": "https://openrouter.ai/api/v1/models",
    "source_tier": "T1",
    "currency": "USD",
    "collection_method": "fixture",
    "confidence_level": "high",
    "context_window": 32000
  },
  {
    "observation_id": "obs-2026-01-01-meta-llama31-405b",
    "schema_version": "1.0.0",
    "provider": "meta",
    "model_id": "llama-3.1-405b-instruct",
    "model_display_name": "Llama 3.1 405B Instruct",
    "input_rate_usd_per_1m": 2.70,
    "output_rate_usd_per_1m": 2.70,
    "effective_date": "2026-01-01",
    "collected_at": "2026-01-01T00:00:00Z",
    "source_url": "https://openrouter.ai/api/v1/models",
    "source_tier": "T1",
    "currency": "USD",
    "collection_method": "fixture",
    "confidence_level": "high",
    "context_window": 131072,
    "notes": "Pricing via Together AI"
  },
  {
    "observation_id": "obs-2026-01-01-meta-llama31-70b",
    "schema_version": "1.0.0",
    "provider": "meta",
    "model_id": "llama-3.1-70b-instruct",
    "model_display_name": "Llama 3.1 70B Instruct",
    "input_rate_usd_per_1m": 0.52,
    "output_rate_usd_per_1m": 0.75,
    "effective_date": "2026-01-01",
    "collected_at": "2026-01-01T00:00:00Z",
    "source_url": "https://openrouter.ai/api/v1/models",
    "source_tier": "T1",
    "currency": "USD",
    "collection_method": "fixture",
    "confidence_level": "high",
    "context_window": 131072,
    "notes": "Pricing via Together AI"
  }
]
